{
  "snapshot_id": "snap_01JARQ5XB3ABCDEFGHJKMNPQRS",
  "entity_id": "organvm-engine",
  "timestamp": "2026-03-13T12:00:00+00:00",
  "properties": {
    "name": "organvm-engine",
    "promotion_status": "PUBLIC_PROCESS",
    "tier": "flagship",
    "public": true,
    "ci_workflow": "ci.yml",
    "platinum_status": true,
    "implementation_status": "ACTIVE",
    "last_validated": "2026-03-10T00:00:00Z"
  },
  "metric_values": {
    "test_count": 1937.0,
    "code_files": 44.0
  },
  "structural_fingerprint": "",
  "variable_bindings": {},
  "metadata": {}
}
